{
  "schemaVersion": "golden-path.v1",
  "status": "planning_evidence",
  "catalog": {
    "thesis": "The two registered paths are the movement vocabulary's founding evidence: cross-family movement via admitted bridges (route-dependence, anticipation/prolongation axis) and same-family movement via window traversal (stepwise L/R versus the M successor, linear versus stepped brightness).",
    "segmentation": "Routes are selected gestaltwise (the cadence-as-gesture) and verified hopwise (membership, containment, seam flags). Boundary-layer exhibit routes (d-cycle:*): structural demonstrations of the D-tier M-cycles, verified against the BL-029 probe, not musical routes.",
    "promotion": "Finder-derived routes enter as candidates (derived-path records); registration requires the same human layer as the founders — audition plus recorded verdicts. Machine derivation alone never promotes.",
    "versioning": "Additive-only contract: v1.x bumps may add optional fields or enum members; registered records are never migrated or rewritten. v1.1 (BL-030): added the boundary-demonstration substrate, cycle demonstration move, and exhibit verdict; additive only."
  },
  "paths": [
    {
      "pathId": "c-minor-parallel-seam",
      "substrate": "golden-path",
      "tonicPitchClass": 0,
      "origin": {
        "nodeId": "7-35:3",
        "mode": "aeolian",
        "modeTonicPitchClass": 0,
        "pitchClasses": [0, 2, 3, 5, 7, 8, 10]
      },
      "destination": {
        "nodeId": "7-32:0",
        "mode": "harmonic-minor",
        "modeTonicPitchClass": 0,
        "pitchClasses": [0, 2, 3, 5, 7, 8, 11]
      },
      "seam": {
        "kind": "raised-seventh",
        "driftSemitones": 1,
        "replacedPitchClass": 10,
        "raisedPitchClass": 11,
        "commonTones": 6
      },
      "interiorKernels": [
        { "courtPositionId": "C2", "nodeId": "5-35:10", "pitchClasses": [0, 2, 5, 7, 10] },
        { "courtPositionId": "C3", "nodeId": "5-35:3", "pitchClasses": [0, 3, 5, 7, 10] },
        { "courtPositionId": "C4", "nodeId": "5-35:8", "pitchClasses": [0, 3, 5, 8, 10] }
      ],
      "bridge": {
        "chosen": { "nodeId": "5-27:0", "setClassId": "5-27", "pitchClasses": [0, 3, 5, 7, 8] },
        "alternative": { "nodeId": "5-23:0", "setClassId": "5-23", "pitchClasses": [0, 2, 3, 5, 7] },
        "basis": "maintainer listening audition: 5-27 has more character/energy; both legal, selectable as voicing options",
        "legalityNote": "both-collections-containment per derived/hypergraph/bipartite-inclusion-v1.json"
      },
      "hops": [
        {
          "index": 0,
          "kind": "chord",
          "label": "Cm (aeolian)",
          "nodeId": "7-35:3",
          "chordLabel": "Cm",
          "chordRoot": 0,
          "collection": "aeolian",
          "pitchClasses": [0, 3, 7],
          "seamCrossing": false,
          "legality": "collection-membership"
        },
        {
          "index": 1,
          "kind": "chord",
          "label": "Bb (aeolian)",
          "nodeId": "7-35:3",
          "chordLabel": "Bb",
          "chordRoot": 10,
          "collection": "aeolian",
          "pitchClasses": [10, 2, 5],
          "seamCrossing": false,
          "legality": "collection-membership"
        },
        {
          "index": 2,
          "kind": "chord",
          "label": "Ab (aeolian)",
          "nodeId": "7-35:3",
          "chordLabel": "Ab",
          "chordRoot": 8,
          "collection": "aeolian",
          "pitchClasses": [8, 0, 3],
          "seamCrossing": false,
          "legality": "collection-membership"
        },
        {
          "index": 3,
          "kind": "bridge",
          "label": "bridge 5-27:0 [seam crossing]",
          "nodeId": "5-27:0",
          "chordLabel": "",
          "chordRoot": null,
          "collection": "bridge",
          "pitchClasses": [0, 3, 5, 7, 8],
          "seamCrossing": true,
          "legality": "both-collections-containment"
        },
        {
          "index": 4,
          "kind": "chord",
          "label": "G (harmonic-minor) [seam arrival]",
          "nodeId": "7-32:0",
          "chordLabel": "G",
          "chordRoot": 7,
          "collection": "harmonic-minor",
          "pitchClasses": [7, 11, 2],
          "seamCrossing": true,
          "legality": "collection-membership"
        }
      ],
      "verdicts": [
        {
          "verdictId": "seam-motion-not-arrival",
          "status": "recorded",
          "subject": "seam",
          "statement": "The tonic remains C minor throughout; the leading tone (B natural) pulls onward rather than landing. The crossing reads as intra-tonic motion with the cadence's dominant tension unspent at the seam.",
          "source": "scrum/plan/bl-021-golden-path-memo.md",
          "date": "2026-09-27"
        },
        {
          "verdictId": "interior-one-gesture",
          "status": "recorded",
          "subject": "interior",
          "statement": "The three minor chords are perceived as one cadence gesture, not four events; the seam does not fracture the family. The perceptual unit is the gesture while the verification unit stays the hop.",
          "source": "scrum/plan/bl-021-golden-path-memo.md",
          "date": "2026-09-27"
        }
      ]
    },
    {
      "pathId": "c-parallel-minor-mode-axis",
      "substrate": "golden-path-parallel-minor",
      "tonicPitchClass": 0,
      "origin": {
        "nodeId": "7-35:0",
        "mode": "ionian",
        "modeTonicPitchClass": 0,
        "pitchClasses": [0, 2, 4, 5, 7, 9, 11]
      },
      "destination": {
        "nodeId": "7-35:3",
        "mode": "aeolian",
        "modeTonicPitchClass": 0,
        "pitchClasses": [0, 2, 3, 5, 7, 8, 10]
      },
      "modeAxis": {
        "setClassId": "7-35",
        "structurePreserved": true,
        "focalPoint": { "from": "ionian", "to": "aeolian", "tonicPitchClass": 0 },
        "flattenedPitchClasses": [4, 9, 11],
        "sharpenedPitchClasses": [3, 8, 10],
        "commonTones": 4,
        "basis": "same rotated structure, different focal point; the property only same-family structures have"
      },
      "chosen": {
        "direction": "ionian-to-aeolian",
        "moves": ["L7:2741:1717", "L3:1717:1709", "L6:1709:1453"],
        "basis": "flattening direction; stepwise legal-move walk"
      },
      "alternatives": [
        {
          "kind": "reverse-chain",
          "direction": "aeolian-to-ionian",
          "moves": ["R6:1453:1709", "R3:1709:1717", "R7:1717:2741"],
          "basis": "brightening direction; stepwise legal-move walk"
        },
        {
          "kind": "m-demonstration",
          "basis": "audit-real M successor applications; not in the committed legal-move catalog",
          "variants": [
            {
              "variantId": "compress-first-pair",
              "moves": [
                {
                  "operatorId": "M",
                  "applicationId": "M:2741:1709",
                  "canonicalId": "modal:A0:2741:1709",
                  "auditSource": "seven-governors-mutation-algebra-audit/audit/operator-applications.csv:291",
                  "status": "formal_substrate_observed",
                  "legality": "demonstration",
                  "compresses": ["L7:2741:1717", "L3:1717:1709"]
                },
                { "moveId": "L6:1709:1453", "legality": "set-class-preserved" }
              ]
            },
            {
              "variantId": "compress-second-pair",
              "moves": [
                { "moveId": "L7:2741:1717", "legality": "set-class-preserved" },
                {
                  "operatorId": "M",
                  "applicationId": "M:1717:1453",
                  "canonicalId": "modal:A0:1717:1453",
                  "auditSource": "seven-governors-mutation-algebra-audit/audit/operator-applications.csv:165",
                  "status": "formal_substrate_observed",
                  "legality": "demonstration",
                  "compresses": ["L3:1717:1709", "L6:1709:1453"]
                }
              ]
            }
          ]
        }
      ],
      "triadOverlay": [
        { "mode": "ionian", "label": "C major triad", "pitchClasses": [0, 4, 7], "minorThird": false },
        { "mode": "mixolydian", "label": "C major triad", "pitchClasses": [0, 4, 7], "minorThird": false },
        {
          "mode": "dorian",
          "label": "C minor triad",
          "pitchClasses": [0, 3, 7],
          "minorThird": true,
          "note": "the minor third (E-flat) arrives at the Dorian step"
        },
        { "mode": "aeolian", "label": "C minor triad", "pitchClasses": [0, 3, 7], "minorThird": true }
      ],
      "schemaNote": "first multi-path instance: alternatives may differ in hop topology and legality typing (BL-023 generalizes); no bridge is present because the mode-axis path crosses no collection seam",
      "hops": [
        {
          "index": 0,
          "kind": "collection",
          "layer": "walk",
          "label": "C Ionian collection (origin)",
          "nodeId": "7-35:0",
          "mode": "ionian",
          "moveId": null,
          "pitchClasses": [0, 2, 4, 5, 7, 9, 11],
          "legality": "set-class-preserved",
          "setClassId": "7-35",
          "rotationAxis": true,
          "seamCrossing": false
        },
        {
          "index": 1,
          "kind": "collection",
          "layer": "walk",
          "label": "C Mixolydian collection (L7:2741:1717)",
          "nodeId": "7-35:5",
          "mode": "mixolydian",
          "moveId": "L7:2741:1717",
          "pitchClasses": [0, 2, 4, 5, 7, 9, 10],
          "legality": "set-class-preserved",
          "setClassId": "7-35",
          "rotationAxis": true,
          "seamCrossing": false
        },
        {
          "index": 2,
          "kind": "collection",
          "layer": "walk",
          "label": "C Dorian collection (L3:1717:1709)",